{
  "schema_version": 2,
  "generated_from": [
    "domains.json",
    "networklayer/markers.js",
    "RELATIONAL_LAYER.md",
    "Cloudflare API",
    "public HTTP HEAD checks"
  ],
  "snapshot_date": "2026-05-19",
  "records": [
    {
      "host": "algorithmicallocation.ai",
      "folder": "algorithmicallocation.ai",
      "canonical_url": "https://algorithmicallocation.ai/",
      "sitemap_url": "https://algorithmicallocation.ai/sitemap.xml",
      "robots_url": "https://algorithmicallocation.ai/robots.txt",
      "marker_group": "monetary_infrastructure",
      "semantic_axis": "monetary_infrastructure",
      "governance_role": "mirror",
      "strategic_priority": "active",
      "copy_maturity": "published",
      "cloudflare": {
        "zone_status": "active",
        "last_checked": "2026-05-19",
        "security_level": "medium",
        "browser_check": "on",
        "content_converter": {
          "value": "off",
          "editable": false
        },
        "agent_access_rule": {
          "status": "public_paths_exempted",
          "action": "managed_challenge",
          "description": "CivRadar: managed challenge generic non-browser clients"
        },
        "public_access": {
          "homepage_status": 200,
          "homepage_challenged": false,
          "link_header_present": true,
          "index_md_status": 200,
          "index_md_content_type": "text/markdown; charset=utf-8"
        },
        "recommendations": []
      },
      "search_console": {
        "property_type": "domain",
        "sitemap_status": "submitted_success",
        "last_checked": "2026-05-19",
        "notes": "Submitted/verified through Search Console browser workflow."
      },
      "notes": ""
    },
    {
      "host": "algorithmicallocation.com",
      "folder": "AlgorithmicAllocation",
      "canonical_url": "https://algorithmicallocation.com/",
      "sitemap_url": "https://algorithmicallocation.com/sitemap.xml",
      "robots_url": "https://algorithmicallocation.com/robots.txt",
      "marker_group": "monetary_infrastructure",
      "semantic_axis": "monetary_infrastructure",
      "governance_role": "core",
      "strategic_priority": "active",
      "copy_maturity": "published",
      "cloudflare": {
        "zone_status": "active",
        "last_checked": "2026-05-19",
        "security_level": "medium",
        "browser_check": "on",
        "content_converter": {
          "value": "off",
          "editable": false
        },
        "agent_access_rule": {
          "status": "public_paths_exempted",
          "action": "managed_challenge",
          "description": "CivRadar: managed challenge generic non-browser clients"
        },
        "public_access": {
          "homepage_status": 200,
          "homepage_challenged": false,
          "link_header_present": true,
          "index_md_status": 200,
          "index_md_content_type": "text/markdown; charset=utf-8"
        },
        "recommendations": []
      },
      "search_console": {
        "property_type": "domain",
        "sitemap_status": "submitted_success",
        "last_checked": "2026-05-19",
        "notes": "Submitted/verified through Search Console browser workflow."
      },
      "notes": ""
    },
    {
      "host": "algorithmicallocation.systems",
      "folder": "algorithmicallocation.systems",
      "canonical_url": "https://algorithmicallocation.systems/",
      "sitemap_url": "https://algorithmicallocation.systems/sitemap.xml",
      "robots_url": "https://algorithmicallocation.systems/robots.txt",
      "marker_group": "monetary_infrastructure",
      "semantic_axis": "monetary_infrastructure",
      "governance_role": "mirror",
      "strategic_priority": "active",
      "copy_maturity": "published",
      "cloudflare": {
        "zone_status": "active",
        "last_checked": "2026-05-19",
        "security_level": "medium",
        "browser_check": "on",
        "content_converter": {
          "value": "off",
          "editable": false
        },
        "agent_access_rule": {
          "status": "public_paths_exempted",
          "action": "managed_challenge",
          "description": "CivRadar: managed challenge generic non-browser clients"
        },
        "public_access": {
          "homepage_status": 200,
          "homepage_challenged": false,
          "link_header_present": true,
          "index_md_status": 200,
          "index_md_content_type": "text/markdown; charset=utf-8"
        },
        "recommendations": []
      },
      "search_console": {
        "property_type": "domain",
        "sitemap_status": "submitted_success",
        "last_checked": "2026-05-19",
        "notes": "Submitted/verified through Search Console browser workflow."
      },
      "notes": ""
    },
    {
      "host": "algorithmicenforcement.com",
      "folder": "AlgorithmicEnforcement",
      "canonical_url": "https://algorithmicenforcement.com/",
      "sitemap_url": "https://algorithmicenforcement.com/sitemap.xml",
      "robots_url": "https://algorithmicenforcement.com/robots.txt",
      "marker_group": "governance",
      "semantic_axis": "governance",
      "governance_role": "core",
      "strategic_priority": "active",
      "copy_maturity": "published",
      "cloudflare": {
        "zone_status": "active",
        "last_checked": "2026-05-19",
        "security_level": "medium",
        "browser_check": "on",
        "content_converter": {
          "value": "off",
          "editable": false
        },
        "agent_access_rule": {
          "status": "public_paths_exempted",
          "action": "managed_challenge",
          "description": "CivRadar: managed challenge generic non-browser clients"
        },
        "public_access": {
          "homepage_status": 200,
          "homepage_challenged": false,
          "link_header_present": true,
          "index_md_status": 200,
          "index_md_content_type": "text/markdown; charset=utf-8"
        },
        "recommendations": []
      },
      "search_console": {
        "property_type": "domain",
        "sitemap_status": "submitted_success",
        "last_checked": "2026-05-19",
        "notes": "Submitted/verified through Search Console browser workflow."
      },
      "notes": ""
    },
    {
      "host": "algorithmiclegitimacy.ai",
      "folder": "algorithmiclegitimacy.ai",
      "canonical_url": "https://algorithmiclegitimacy.ai/",
      "sitemap_url": "https://algorithmiclegitimacy.ai/sitemap.xml",
      "robots_url": "https://algorithmiclegitimacy.ai/robots.txt",
      "marker_group": "governance",
      "semantic_axis": "governance",
      "governance_role": "mirror",
      "strategic_priority": "active",
      "copy_maturity": "published",
      "cloudflare": {
        "zone_status": "active",
        "last_checked": "2026-05-19",
        "security_level": "medium",
        "browser_check": "on",
        "content_converter": {
          "value": "off",
          "editable": false
        },
        "agent_access_rule": {
          "status": "public_paths_exempted",
          "action": "managed_challenge",
          "description": "CivRadar: managed challenge generic non-browser clients"
        },
        "public_access": {
          "homepage_status": 200,
          "homepage_challenged": false,
          "link_header_present": true,
          "index_md_status": 200,
          "index_md_content_type": "text/markdown; charset=utf-8"
        },
        "recommendations": []
      },
      "search_console": {
        "property_type": "domain",
        "sitemap_status": "submitted_success",
        "last_checked": "2026-05-19",
        "notes": "Submitted/verified through Search Console browser workflow."
      },
      "notes": ""
    },
    {
      "host": "algorithmiclegitimacy.com",
      "folder": "algorithmiclegitimacy",
      "canonical_url": "https://algorithmiclegitimacy.com/",
      "sitemap_url": "https://algorithmiclegitimacy.com/sitemap.xml",
      "robots_url": "https://algorithmiclegitimacy.com/robots.txt",
      "marker_group": "governance",
      "semantic_axis": "governance",
      "governance_role": "core",
      "strategic_priority": "active",
      "copy_maturity": "published",
      "cloudflare": {
        "zone_status": "active",
        "last_checked": "2026-05-19",
        "security_level": "medium",
        "browser_check": "on",
        "content_converter": {
          "value": "off",
          "editable": false
        },
        "agent_access_rule": {
          "status": "public_paths_exempted",
          "action": "managed_challenge",
          "description": "CivRadar: managed challenge generic non-browser clients"
        },
        "public_access": {
          "homepage_status": 200,
          "homepage_challenged": false,
          "link_header_present": true,
          "index_md_status": 200,
          "index_md_content_type": "text/markdown; charset=utf-8"
        },
        "recommendations": []
      },
      "search_console": {
        "property_type": "domain",
        "sitemap_status": "submitted_success",
        "last_checked": "2026-05-19",
        "notes": "Submitted/verified through Search Console browser workflow."
      },
      "notes": ""
    },
    {
      "host": "algorithmicmartiallaw.com",
      "folder": "algorithmicmartiallaw",
      "canonical_url": "https://algorithmicmartiallaw.com/",
      "sitemap_url": "https://algorithmicmartiallaw.com/sitemap.xml",
      "robots_url": "https://algorithmicmartiallaw.com/robots.txt",
      "marker_group": "governance",
      "semantic_axis": "governance",
      "governance_role": "core",
      "strategic_priority": "active",
      "copy_maturity": "published",
      "cloudflare": {
        "zone_status": "active",
        "last_checked": "2026-05-19",
        "security_level": "medium",
        "browser_check": "on",
        "content_converter": {
          "value": "off",
          "editable": false
        },